# Licensed to the Apache Software Foundation (ASF) under one
# or more contributor license agreements.  See the NOTICE file
# distributed with this work for additional information
# regarding copyright ownership.  The ASF licenses this file
# to you under the Apache License, Version 2.0 (the
# "License"); you may not use this file except in compliance
# with the License.  You may obtain a copy of the License at

#   http://www.apache.org/licenses/LICENSE-2.0

# Unless required by applicable law or agreed to in writing,
# software distributed under the License is distributed on an
# "AS IS" BASIS, WITHOUT WARRANTIES OR CONDITIONS OF ANY
# KIND, either express or implied.  See the License for the
# specific language governing permissions and limitations
# under the License.

##########
## MERGE INTO Tests
##
## MERGE INTO planning and basic MemTable execution are supported.
##########

statement ok
create table target(id int, val varchar, qty int);

statement ok
insert into target values (1, 'foo', 100.0);

statement ok
insert into target values (2, 'bar', 200.0);

statement ok
insert into target values (3, 'baz', 300.0);


statement ok
create table source(id int, val varchar, is_active boolean);

statement ok
insert into source values (2, 'xxxx', true);

statement ok
insert into source values (4, 'yyyy', false);


##########
# Logical planning
##########

query TT
explain merge into target using source on target.id = source.id
when matched then update set val = source.val
when not matched then insert (id, val) values (source.id, source.val);
----
logical_plan
01)Dml: op=[MergeInto] table=[target] on=[target.id = source.id] clauses=[WHEN MATCHED THEN UPDATE SET val = source.val, WHEN NOT MATCHED THEN INSERT (id, val) VALUES (source.id, source.val)]
02)--TableScan: source projection=[id, val, is_active]
physical_plan
01)CooperativeExec
02)--DmlResultExec: rows_affected=2

# Simple MATCHED DELETE
query TT
explain merge into target using source on target.id = source.id
when matched then delete;
----
logical_plan
01)Dml: op=[MergeInto] table=[target] on=[target.id = source.id] clauses=[WHEN MATCHED THEN DELETE]
02)--TableScan: source projection=[id, val, is_active]
physical_plan
01)CooperativeExec
02)--DmlResultExec: rows_affected=2

# Aliased target and source preserve their visible qualifiers
query TT
explain merge into target as t using source as s on t.id = s.id
when matched and s.is_active then update set val = s.val
when not matched by source then delete;
----
logical_plan
01)Dml: op=[MergeInto] table=[target] on=[t.id = s.id] clauses=[WHEN MATCHED AND s.is_active THEN UPDATE SET val = s.val, WHEN NOT MATCHED BY SOURCE THEN DELETE]
02)--SubqueryAlias: s
03)----TableScan: source projection=[id, val, is_active]
physical_plan
01)CooperativeExec
02)--DmlResultExec: rows_affected=2

# WHEN NOT MATCHED THEN DELETE is rejected by the parser (no target row exists);
query error DELETE is not allowed in a NOT MATCHED merge clause at Line: 2, Column: 23
merge into target using source on target.id = source.id
when not matched then delete;

# NOT MATCHED BY SOURCE
query TT
explain merge into target using source on target.id = source.id
when not matched by source then delete;
----
logical_plan
01)Dml: op=[MergeInto] table=[target] on=[target.id = source.id] clauses=[WHEN NOT MATCHED BY SOURCE THEN DELETE]
02)--TableScan: source projection=[id, val, is_active]
physical_plan
01)CooperativeExec
02)--DmlResultExec: rows_affected=0

# Subquery as the USING source
query TT
explain merge into target using (select id, max(val) as val from source group by id) as s
on target.id = s.id
when matched then update set val = s.val;
----
logical_plan
01)Dml: op=[MergeInto] table=[target] on=[target.id = s.id] clauses=[WHEN MATCHED THEN UPDATE SET val = s.val]
02)--SubqueryAlias: s
03)----Projection: source.id, max(source.val) AS val
04)------Aggregate: groupBy=[[source.id]], aggr=[[max(source.val)]]
05)--------TableScan: source projection=[id, val]
physical_plan
01)CooperativeExec
02)--DmlResultExec: rows_affected=0

# INSERT without an explicit column list requires values for all target columns
query TT
explain merge into target using source on target.id = source.id
when not matched then insert values (source.id, source.val, 0);
----
logical_plan
01)Dml: op=[MergeInto] table=[target] on=[target.id = source.id] clauses=[WHEN NOT MATCHED THEN INSERT VALUES (source.id, source.val, Int32(0) AS Int64(0))]
02)--TableScan: source projection=[id, val, is_active]
physical_plan
01)CooperativeExec
02)--DmlResultExec: rows_affected=2

##########
# MemTable execution
##########

statement ok
create table exec_target(id int, val varchar, qty int);

statement ok
insert into exec_target values (1, 'old', 10), (2, 'keep', 20);

statement ok
create table exec_source(id int, val varchar, qty int, flag boolean);

statement ok
insert into exec_source values (1, 'new', 100, true), (3, 'add', 30, true);

query I
merge into exec_target using exec_source on exec_target.id = exec_source.id
when matched and exec_source.flag then update set val = exec_source.val, qty = exec_source.qty
when matched then update set val = 'second'
when not matched then insert (id, val, qty) values (exec_source.id, exec_source.val, exec_source.qty);
----
2

query ITI rowsort
select * from exec_target;
----
1 new 100
2 keep 20
3 add 30

statement ok
create table delete_target(id int, val varchar);

statement ok
insert into delete_target values (1, 'one'), (2, 'two'), (3, 'three');

statement ok
create table delete_source(id int);

statement ok
insert into delete_source values (2);

query I
merge into delete_target using delete_source on delete_target.id = delete_source.id
when matched then delete;
----
1

query IT rowsort
select * from delete_target;
----
1 one
3 three

statement ok
create table source_miss_target(id int, val varchar);

statement ok
insert into source_miss_target values (1, 'one'), (2, 'two'), (3, 'three');

statement ok
create table source_miss_source(id int);

statement ok
insert into source_miss_source values (2);

query I
merge into source_miss_target using source_miss_source on source_miss_target.id = source_miss_source.id
when not matched by source and source_miss_target.id = 1 then update set val = 'stale'
when not matched by source and source_miss_target.id = 3 then delete;
----
2

query IT rowsort
select * from source_miss_target;
----
1 stale
2 two

statement ok
create table null_pred_target(id int, val varchar);

statement ok
insert into null_pred_target values (1, 'old');

statement ok
create table null_pred_source(id int, val varchar);

statement ok
insert into null_pred_source values (1, 'new'), (2, 'add');

query I
merge into null_pred_target using null_pred_source on null
when matched then update set val = null_pred_source.val
when not matched and null then insert (id, val) values (null_pred_source.id, null_pred_source.val);
----
0

query IT rowsort
select * from null_pred_target;
----
1 old

statement ok
create table default_target(id int, val varchar default 'missing', qty int);

statement ok
create table default_source(id int);

statement ok
insert into default_source values (10);

query I
merge into default_target using default_source on false
when not matched then insert (id) values (default_source.id);
----
1

query ITI
select * from default_target;
----
10 missing NULL

statement ok
create table dup_target(id int, val varchar);

statement ok
insert into dup_target values (1, 'old');

statement ok
create table dup_source(id int, val varchar);

statement ok
insert into dup_source values (1, 'new'), (1, 'newer');

statement error MERGE INTO matched target row 0 with more than one source row
merge into dup_target using dup_source on dup_target.id = dup_source.id
when matched then update set val = dup_source.val;

query IT
select * from dup_target;
----
1 old


##########
# Type coercion of ON / WHEN conditions
##########

statement error DataFusion error: type_coercion\ncaused by\nError during planning: MERGE ON condition must be boolean type, but got Int64
merge into target using source on 1
when matched then delete;

statement error DataFusion error: type_coercion\ncaused by\nError during planning: MERGE WHEN condition must be boolean type, but got Utf8
merge into target using source on target.id = source.id
when matched and 'yes' then delete;

##########
# Planning errors: invalid structure
##########

statement error DataFusion error: Error during planning: MERGE INTO requires at least one WHEN clause
merge into target using source on target.id = source.id;

statement error DataFusion error: Error during planning: Duplicate column 'val' in MERGE UPDATE
merge into target using source on target.id = source.id
when matched then update set val = source.val, val = 'x';

statement error DataFusion error: Error during planning: Duplicate column 'id' in MERGE INSERT
merge into target using source on target.id = source.id
when not matched then insert (id, ID) values (1, 2);

statement error DataFusion error: Error during planning: MERGE INSERT has 2 column\(s\) but 1 value\(s\)
merge into target using source on target.id = source.id
when not matched then insert (id, val) values (source.id);

statement error DataFusion error: Error during planning: MERGE INSERT has 3 column\(s\) but 2 value\(s\)
merge into target using source on target.id = source.id
when not matched then insert values (source.id, source.val);

statement error DataFusion error: Error during planning: MERGE INSERT must have exactly one row of values
merge into target using source on target.id = source.id
when not matched then insert (id) values (1), (2);

# Unknown column in UPDATE assignment
statement error DataFusion error: Schema error: No field named nonexistent.
merge into target using source on target.id = source.id
when matched then update set nonexistent = 1;

# Unknown column in INSERT column list
statement error DataFusion error: Schema error: No field named nonexistent.
merge into target using source on target.id = source.id
when not matched then insert (nonexistent) values (1);

# UPDATE assignment must reference the target table
statement error DataFusion error: Error during planning: MERGE assignment target 's.val' must reference target table 't'
merge into target as t using source as s on t.id = s.id
when matched then update set s.val = 'x';

##########
# Planning errors: qualifier and alias handling
##########

# A source alias may equal the target table name when the target has another alias
query I
merge into target as t using source as target on t.id = target.id
when matched then delete;
----
1

# Target-correlated subqueries preserve the visible target qualifier
statement error DataFusion error: MERGE INTO operation on table 'target'\ncaused by\nThis feature is not implemented: Physical plan does not support logical expression.*
merge into target as t using source as s
on exists (select 1 from source x where x.id = t.id)
when matched then delete;

##########
# Planning errors: unsupported syntax
##########

statement error DataFusion error: This feature is not implemented: MERGE target table modifiers are not supported
merge into target partition (p0) using source on target.id = source.id
when matched then delete;

statement error DataFusion error: This feature is not implemented: MERGE target alias column lists are not supported
merge into target as t(a, b) using source as s on t.a = s.id
when matched then delete;

statement error DataFusion error: This feature is not implemented: MERGE UPDATE WHERE predicates are not supported
merge into target using source on target.id = source.id
when matched then update set val = source.val where source.is_active;

statement error DataFusion error: This feature is not implemented: MERGE INSERT WHERE predicates are not supported
merge into target using source on target.id = source.id
when not matched then insert (id) values (source.id) where source.is_active;

statement error DataFusion error: This feature is not implemented: MERGE INSERT ROW is not supported
merge into target using source on target.id = source.id
when not matched then insert row;

statement ok
drop table exec_target;

statement ok
drop table exec_source;

statement ok
drop table delete_target;

statement ok
drop table delete_source;

statement ok
drop table source_miss_target;

statement ok
drop table source_miss_source;

statement ok
drop table null_pred_target;

statement ok
drop table null_pred_source;

statement ok
drop table default_target;

statement ok
drop table default_source;

statement ok
drop table dup_target;

statement ok
drop table dup_source;

statement ok
drop table target;

statement ok
drop table source;
